{
  "schema_version": "asi_stack.p6_9_raw_scaffold_ownership_audit.v1",
  "audit_id": "P6.9-R21-raw-scaffold-ownership-audit",
  "recorded_date": "2026-07-28",
  "state": "terminal_complete",
  "scope": {
    "manifest_chapter_count": 84,
    "manifest_path": "book_structure.json",
    "chapter_corpus_sha256": "1ca22eb5c34a49ee2874f8c8732621370bf65344880733ce9c383bedcabb65f0",
    "normalization": "Unicode NFKC; CRLF normalized to LF",
    "token_pattern": "[A-Za-z0-9_`'-]+",
    "n_gram_size": 12,
    "minimum_chapter_spread": 8,
    "classification_scope": "every raw-QMD 12-gram at the current maximum chapter spread"
  },
  "w3_binding": {
    "path": "evidence_quality/p7_1a_w3_inheritance_guard.json",
    "sha256": "53eee9fe37acb5654e1fad22d92ff65450d0d24f5f6321549233ef4c5e4dffc1",
    "raw_repeated_12_gram_count": 1319,
    "raw_maximum_chapter_spread": 70,
    "reader_facing_repeated_12_gram_count": 0,
    "reader_facing_maximum_chapter_spread": 0
  },
  "widest_block_records": [
    {
      "sha256": "af9678ff8261c9629b8464d802c27bdf70a51d49cbdc749255b514c7b8e42ded",
      "normalized_text": "ASI result is established by this reconciliation row -- manifest-source-reconciliation end --",
      "word_tokens": 12,
      "chapter_spread": 70,
      "chapter_ids": [
        "adversarial-evaluation-sandbagging-and-training-time-deception",
        "adversarial-machine-learning-and-model-attack-surface",
        "ai-deployment-transition-distribution-and-human-agency",
        "ai-supply-chain-integrity-and-lifecycle-provenance",
        "artifact-graphs-audit-logs-and-replay",
        "artifact-steward-agents-and-living-project-governance",
        "asi-is-a-stack-not-a-model",
        "benchmark-ratchets-and-anti-goodhart-evidence",
        "capability-replacement-and-rollback",
        "claim-ledgers-and-belief-revision",
        "cognitive-compilation-and-semantic-ir",
        "compact-generative-systems-and-residual-honesty",
        "constitutional-alignment-substrate",
        "content-authenticity-watermarking-and-synthetic-media-integrity",
        "context-transactions-snapshots-mounts-and-taint",
        "dangerous-capability-domains-and-misuse-uplift",
        "data-engines-continual-learning-and-unlearning",
        "durable-semantic-memory-and-knowledge-lattices",
        "embodied-agency-real-time-control-and-physical-safety",
        "evidence-states-and-claim-discipline",
        "executable-specifications-and-lean-proof-envelope",
        "failure-modes-of-ungoverned-intelligence",
        "fast-generation-architectures",
        "governed-deliberation-and-test-time-scaling",
        "governed-model-training-distributed-optimization-and-scaling",
        "governed-operations-incident-command-and-graceful-degradation",
        "governed-world-models-and-reality-grounding",
        "human-ai-communication-persuasion-and-epistemic-security",
        "human-ai-organizations-delegation-and-accountability",
        "human-intent-as-a-formal-input",
        "institutions-international-coordination-and-public-legitimacy",
        "integrated-reference-architecture",
        "intent-to-execution-contracts",
        "inter-stack-protocols-identity-and-economic-exchange",
        "labor-os-and-typed-jobs",
        "learning-theory-generalization-and-scaling-science",
        "living-book-methodology",
        "mathematical-and-search-substrates",
        "model-weight-custody-and-hardware-roots-of-trust",
        "moral-uncertainty-and-value-conflict",
        "multi-agent-dynamics-collective-intelligence-and-systemic-risk",
        "open-ended-improvement-engines",
        "open-research-agenda-and-bibliography-plan",
        "open-weight-release-and-post-release-control",
        "personal-compute-hives-and-federated-edge-intelligence",
        "physical-compute-infrastructure-energy-and-environmental-constraints",
        "planning-as-a-control-layer",
        "policy-optimization-and-learning-from-feedback",
        "privacy-data-rights-and-information-flow-governance",
        "procedural-memory-and-cognitive-loop-closure",
        "project-theseus-as-report-first-implementation-reference",
        "prototype-roadmap",
        "rankfold-neuralfold-and-artifact-compression",
        "readiness-gates-residual-escrow-and-quarantine",
        "recursive-self-improvement-boundaries",
        "relational-dimension-compilation-and-polyadic-cognition",
        "replaceable-cognitive-substrates-beyond-transformer-monoculture",
        "resource-economics-and-token-budgets",
        "routing-heads-and-specialist-cores",
        "runtime-adapters-tool-permissions-and-human-approval",
        "scalable-oversight-and-adversarial-ai-control",
        "scientific-discovery-and-experimental-governance",
        "security-kernel-and-digital-scifs",
        "societal-resilience-and-misuse-defense",
        "spinoza-verification-and-proof-carrying-claims",
        "stable-capability-fields",
        "the-efficient-asi-hypothesis",
        "verification-bandwidth-and-context-adequacy",
        "virtual-context-abi",
        "white-box-evidence-interpretability-and-activation-governance"
      ],
      "chapter_ids_sha256": "f36f0285b37bd3d94b287cdf9707b668406f760c6fce93dc07bc330721308f16",
      "reader_visible": false,
      "generated": true,
      "structured": true,
      "source_only": true,
      "owner": "scripts/sync_chapter_source_crosswalks.py",
      "regeneration_path": "book_structure.json -> scripts/sync_chapter_source_crosswalks.py -> manifest-source-reconciliation marker block",
      "semantic_purpose": "Preserve generated manifest-source assignment, intake role, and no-promotion boundaries at the chapter source interface.",
      "disposition": "generate",
      "rationale": "The exact 12-token fingerprint occurs only inside the marked generated source-reconciliation projection in every owning chapter. Central generator custody is safer than bespoke edits; W3 excludes the marker block from the reader-facing projection."
    },
    {
      "sha256": "617d65a123be56b6c68e203a3f3bef40614a0b2ce9603e3de1c1f18e7b0a9476",
      "normalized_text": "Passage review does not establish local reproduction performance safety deployment or support-state",
      "word_tokens": 12,
      "chapter_spread": 70,
      "chapter_ids": [
        "adversarial-evaluation-sandbagging-and-training-time-deception",
        "adversarial-machine-learning-and-model-attack-surface",
        "ai-deployment-transition-distribution-and-human-agency",
        "ai-supply-chain-integrity-and-lifecycle-provenance",
        "artifact-graphs-audit-logs-and-replay",
        "artifact-steward-agents-and-living-project-governance",
        "asi-is-a-stack-not-a-model",
        "benchmark-ratchets-and-anti-goodhart-evidence",
        "capability-replacement-and-rollback",
        "claim-ledgers-and-belief-revision",
        "cognitive-compilation-and-semantic-ir",
        "compact-generative-systems-and-residual-honesty",
        "constitutional-alignment-substrate",
        "content-authenticity-watermarking-and-synthetic-media-integrity",
        "context-transactions-snapshots-mounts-and-taint",
        "dangerous-capability-domains-and-misuse-uplift",
        "data-engines-continual-learning-and-unlearning",
        "durable-semantic-memory-and-knowledge-lattices",
        "embodied-agency-real-time-control-and-physical-safety",
        "evidence-states-and-claim-discipline",
        "executable-specifications-and-lean-proof-envelope",
        "failure-modes-of-ungoverned-intelligence",
        "fast-generation-architectures",
        "governed-deliberation-and-test-time-scaling",
        "governed-model-training-distributed-optimization-and-scaling",
        "governed-operations-incident-command-and-graceful-degradation",
        "governed-world-models-and-reality-grounding",
        "human-ai-communication-persuasion-and-epistemic-security",
        "human-ai-organizations-delegation-and-accountability",
        "human-intent-as-a-formal-input",
        "institutions-international-coordination-and-public-legitimacy",
        "integrated-reference-architecture",
        "intent-to-execution-contracts",
        "inter-stack-protocols-identity-and-economic-exchange",
        "labor-os-and-typed-jobs",
        "learning-theory-generalization-and-scaling-science",
        "living-book-methodology",
        "mathematical-and-search-substrates",
        "model-weight-custody-and-hardware-roots-of-trust",
        "moral-uncertainty-and-value-conflict",
        "multi-agent-dynamics-collective-intelligence-and-systemic-risk",
        "open-ended-improvement-engines",
        "open-research-agenda-and-bibliography-plan",
        "open-weight-release-and-post-release-control",
        "personal-compute-hives-and-federated-edge-intelligence",
        "physical-compute-infrastructure-energy-and-environmental-constraints",
        "planning-as-a-control-layer",
        "policy-optimization-and-learning-from-feedback",
        "privacy-data-rights-and-information-flow-governance",
        "procedural-memory-and-cognitive-loop-closure",
        "project-theseus-as-report-first-implementation-reference",
        "prototype-roadmap",
        "rankfold-neuralfold-and-artifact-compression",
        "readiness-gates-residual-escrow-and-quarantine",
        "recursive-self-improvement-boundaries",
        "relational-dimension-compilation-and-polyadic-cognition",
        "replaceable-cognitive-substrates-beyond-transformer-monoculture",
        "resource-economics-and-token-budgets",
        "routing-heads-and-specialist-cores",
        "runtime-adapters-tool-permissions-and-human-approval",
        "scalable-oversight-and-adversarial-ai-control",
        "scientific-discovery-and-experimental-governance",
        "security-kernel-and-digital-scifs",
        "societal-resilience-and-misuse-defense",
        "spinoza-verification-and-proof-carrying-claims",